date,ratings,text,negative_score,positive_score,sentiment
2021-03-04,10,exceptional show tell plot show thought thoroughly first two episodes released reveal episode personally enjoyed first episodes understand slow fair rate series first episodes excellent show,0.0,0.684,POSITIVE
2021-01-15,1,want minutes back watched first two episodes want time back idea people behind series want failed miserably,0.287,0.175,NEGATIVE
2021-03-03,10,innovative yet pure pure pop culture refreshing watch blockbuster show actually daring something completely yet purely entertaining may fully speak younger audience growing marvel movie franchise certainly resonate older generation movie buffs tv audience actually experienced movie making particularly tv shows done packing new costume result worth watching marvel fan sorts hooked first moment creating something unique new satisfying costumer still surprised got show done brave innovative plot unfolds nothing new awaits executed portrayed truly superb hommage filmmaking innovative way pulled gotta applaud giving full,0.01,0.445,POSITIVE
2021-01-16,1,shameful exploitation waste time biased fans please dont rate want high rating honest really consider im generous id give really wanted like doesnt really help show get better producers wont seek improve show supposed comedy finished episodes much smile waited waited please watch show give honest opinion gave chance im honest extremely lame maybe aimed disney childrens crowd even falls short,0.194,0.312,POSITIVE
2021-01-22,8,confused intrigued weird parts show mildly interesting lot boring parts well genuinely confused watching first episode watching second helped show gain interest dont understand overall goal show fits timeline paul bettany reason jokes land believe show trying hard comedic scenes women bit weird many seem overacted hope time goes show becomes less confusing,0.315,0.301,NEGATIVE
2021-02-19,2,dragging like watching boring movie takes forever get plot disappointed wait pandemic supposed super heroes im interested mental health issues unless tons action far action minimum thatll teach expect action genre hopefully falcon winter soldier action less feelings,0.323,0.222,NEGATIVE
2021-01-23,7,overrated far first episodes weak boring weird get jetsons dream jeanie bewitched honeymooners throwbacks wrapped one thought something anything would happen nothing ill give episode deuces,0.522,0.085,NEGATIVE
2021-01-25,4,mockery funny first episodes new interesting mocking early television interesting way get viewers money 3rd episode asleep mins thanks skip future nonsense,0.379,0.265,NEGATIVE
2021-03-03,1,zero stars doesnt seem clear plot direction map may well watch dream jeannie,0.134,0.252,POSITIVE
2021-05-16,9,amazing marvel series honest overall series amazing none marvel movies series made laugh much great series filled action comedy romance good see old characters like darcy monica marvel fan must watch series,0.0,0.785,POSITIVE
2021-03-28,10,must watch mcu fans fantastic show every actor excellent job happy biggest fan mcu,0.0,0.787,POSITIVE
2021-03-05,8,great feat marvel studios writing review exactly hour finishing wandavision say marvel knows play game every aspect series well developed well acting paul bettany scarlet witch elizabeth olsen brilliant guess beginning many mystical subjects yet come future rating series feel wasted opportunity viewers come know finishing finale keep,0.06,0.543,POSITIVE
2022-10-11,8,intriguing fantastic show every actor excellent job happy biggest fan mcu,0.0,0.881,POSITIVE
2021-03-06,6,slightly average story good one marvel stories different kinks told story first three episodes pretty boring little action lot references things people even huge fans would clue neat surprises wont spoil episodes great however ending fell kind flat due lame reveals lack promised cameos end fans appreciate leave feeling somewhat underwhelmed,0.296,0.342,POSITIVE
2021-03-02,9,love wanda vision small spoiler small fantastic show every actor excellent job happy biggest fan mcu,0.0,0.81,POSITIVE
2021-02-26,6,watched previously mcu begin review must say im comic books fan dont follow mcu movies dropped since second thor overgrown brainless movies believe comic books adaptations shallow superficial plain dumb base opinion upon everything ive heard every little homework watching wandavision later ive seen first glimpse show surprised showed black white old style sitcoms vein love lucy dick van dyke show bewitched naturally pumped love old hollywood absolutely adore shows decided give show go heck ive nothing lose lose much time first three episodes good right real life started interfering didnt understand easter eggs references watch guys youtube explaining every little detail telling little theories think eventually happen real villain killed get point realized could enjoy show without homework every episode watched answers needed guess everyone way guys dont want call nerds professional comic book fans sound better eager episode coming translated character comic mcu universe expanded addition fox disney heroes doubles parallel universes possible die reborn die cares dont watch show movie show movie purpose researching first make heads tails everything good quality picture offer guess people cinema industry sold idea making sequels reboots remakes forgot original ideas still plenty used reason guys think people dumb want watch neverending tv show santa barbara days gone deal main problem audience wandavision mcu fans get references classic tv shows mostly rest eat skin give highest praise possible see happened already total score feb 27th rest viewers confused certain episode case 8th stop watching mystery unravels lose grip hadnt paid attention previously avengers neverendgame dont get wrong show made beautifully script fine every little detail noted everything place professional comic book fans kindly explained acting good great effects outstanding otherwise disney make bad job even tried paid homage old classic shows adds extra points review overall dont see interesting non mcu fan one starts watching show season reading book chapter wandavision exactly season chapter saddest fact though episode show becomes less less wanda vision characters end supposed build upcoming movie franchise dont want spend time watching endless movies endless characters seem never fully die anyway,0.123,0.236,POSITIVE
2021-01-16,1,give less star shame embarrassment great universe come love,0.178,0.659,POSITIVE
2021-01-16,5,average entertainment plain simple truman show mixed twilight zone opinion sitcom angle might lead another mcu villain xmen universe wanda also part mojo guess didnt care characters show dont waste time average interesting,0.148,0.186,POSITIVE
2021-01-19,10,saw first two episodes love risk taking love excited see going everyone butttttt,0.096,0.493,POSITIVE
2021-03-05,10,give perfect shall crying watched season finale quite different expected see personally perfect oh scarlet witch youre new found love,0.084,0.692,POSITIVE
2021-03-11,6,agents shield level get may aimed younger disney audience found meh agents shield interesting vintage stuff probably weird kids get bored goes far long order stretch series intrigue finally starts doesnt hook marvel fan anyone else wont back another season falcon winter soldiers doesnt step im done disney,0.118,0.217,POSITIVE
2021-01-17,10,one best creation made marvel fantastic show every actor excellent job happy biggest fan mcu,0.0,0.881,POSITIVE
2021-01-26,1,boring three episodes nothing substance happened hold watching next episodes see reviews state show finally turned page goofy 1960s sitcom confident saved point,0.297,0.162,NEGATIVE
2021-06-07,7,disappointing second half great start watch series homage hollywood iconic series interesting plenty laughs sadly laughs ends main plot starts honestly nothing great even revelations feel boring hope end,0.205,0.566,POSITIVE
2021-01-31,9,bridge next phase shows development reminds agents shield progressed somewhat boring cliched adventurous creative episode four point hope one takes yes tiny glimpses lies beneath cheesy sit com surface none closing sequence episode one cat almost bag unsure direction take pondering used bridge next phase mcu introduction new less familiar characters shall see production values good visuals come expect marvel studios humorous touches subtle done high hopes keep watching irrespective reviewer comments opinions subjective think whole thing needs seen really form conclusive review mine may change enjoying,0.114,0.33,POSITIVE
2021-01-15,1,boring worth anyones time nothing interesting plain boring,0.804,0.063,NEGATIVE
2022-06-04,6,slow start utterly compelling wanda lead alright show could better needs story,0.0,0.166,POSITIVE
2021-01-17,9,refreshing fantastic show every actor excellent job happy biggest fan mcu,0.0,0.836,POSITIVE
2021-02-06,9,first three episodes great fantastic show every actor excellent job happy biggest fan mcu,0.0,0.85,POSITIVE
2021-03-19,10,wanda vision web series best web series marvel characters awesome specially scarlett witch white vision awesome,0.035,0.839,POSITIVE
2021-01-16,10,splendid super hot fire fr tho cause actually good idk like love exciting think gonna show also great way bring marvel universe next phase,0.049,0.77,POSITIVE
2021-05-08,9,unique solid series loved series think great first entry tv marvel studios unique different past movies incorporation sitcom aspect brilliant idea opinion worked well show actors cast really able shine result elizabeth olsen paul bettany kathryn hahn teyonah parris excelled roles nailed multiple decades sitcom acting great performances real critique ending series specifically last episode didnt fully stick landing several characters like monica didnt really get due feel set supposed overall enjoyable series ai would recommend anyone questioning whether watch,0.01,0.518,POSITIVE
2021-01-31,10,perfect story moves gets exciting character art good,0.0,0.876,POSITIVE
2021-02-05,8,get past first get past bizarre first episodes intentionally bizarre rewarded ep show pulls together brilliantly turned first couple really pick show back,0.149,0.234,POSITIVE
2021-06-03,5,dont know rate show highly gets 1st episodes long boring shouldve cut episode friends drop watching 3rd episode tell em continue get better ep4 onwards afterwards unveiling main villain finale good ending meh know kinda end wrote kid english essay story ends suddenly woke bad dream ending ugh,0.429,0.173,NEGATIVE
2021-03-05,1,underwhelming underwhelming lot build pay really disappointed end similar game thrones experience,0.559,0.0,NEGATIVE
2021-01-23,10,one marvel ambitious projects people seem understand wandavision supposed corny supposed mirror sitcoms 50s 90s episode different era 50s 60s 70s show great providing enough mystery weirdness keep viewers watching casual marvel fans bash show weird slow boring episode progresses plot thickens show phenomenal would definitely recommend,0.177,0.362,POSITIVE
2021-01-15,10,mysterious intriguing littered easter eggs fantastic show every actor excellent job happy biggest fan mcu,0.0,0.825,POSITIVE
2022-01-28,5,twisted morals alright show could better needs story,0.0,0.0,NEGATIVE
2021-03-05,8,underwelming dont think worth wait weeks honestlu idk mixed feeling show things good tyat good hope take end credit scene something intresting lot tease satisfying end seen track record marvel could surprise us faith quicksilver introduce xmen thought seeing magic spells bring dr strange,0.07,0.515,POSITIVE
2021-07-09,9,entertaining great something different offer mcu compelling concept pretty good execution,0.0,0.854,POSITIVE
2021-04-12,9,splendid fantastic show every actor excellent job happy biggest fan mcu,0.0,0.89,POSITIVE
2021-01-15,10,keeps guessing guessing n guessing n best thing series elisabeth olsen marvel cinematic universe back bang show keeps guessing happen next compel watch next next best thing show elizabeth olsen deserves oscar role wanda show mean someone says comic movies shows doesnt acting would love show done role wandavision something hasnt done marvel dc worth watching,0.033,0.491,POSITIVE
2021-01-31,10,best marvel show fantastic show every actor excellent job happy biggest fan mcu,0.0,0.89,POSITIVE
2021-03-01,8,good expected fantastic show every actor excellent job happy biggest fan mcu,0.0,0.866,POSITIVE
2021-01-15,10,haters eat words end phase well see connected part bigger picture shows started youll wondering didnt vision xoxox,0.224,0.095,NEGATIVE
2021-04-01,5,overrated cant understand fairness marvel fans worse blind one want see average series nothing wow,0.683,0.04,NEGATIVE
2021-01-19,1,well well well looked forward entertained well written screen play quality cast soon realised episode funny clever entertaining even hooked anyway hope held onto episode would better left thinking time machine missed 80s 90s oos etc probably worst mcu seen feel cast im sure contracted read script sorry poor clever anyone thinks please stop taking ketamine,0.296,0.326,POSITIVE
2021-01-17,10,diferent doesnt make bad great time watching creepy mysterious especially second episode,0.397,0.275,NEGATIVE
2021-03-20,5,gives new meaning jumped shark disney really desperate monitize every dollar marvel franchise first idea sounds great doesnt mean like someone watched pleasantville came pleasantville phenomenal feels like content sake content lost whatever respect marvel universe even concept superheroes elizabeth paul fantastic production values phenomenal idea asking much suspension disbelief many ideas rejected original content decided,0.122,0.448,POSITIVE
2021-06-16,8,originalty format really confusing times liked wandas living sitcom thing including fake commercials catchy songs season nice weird fun touch hope come back give good ending,0.282,0.404,POSITIVE
2021-02-06,9,pietro fantastic show every actor excellent job happy biggest fan mcu,0.0,0.836,POSITIVE
2021-11-20,8,neverending story enjoyable last episode marvel universe getting long tooth need give us new eyeball food bs special effects cgi punch flying around fight scene,0.081,0.262,POSITIVE
2021-06-08,9,hats writer fantastic show every actor excellent job happy biggest fan mcu,0.0,0.819,POSITIVE
2021-03-20,7,underwhelming wandavision feels like marvel film shouldnt bad thing would like see marvel projects like cant help feel like one didnt stick landing well first episodes okay next good felt like last two episodes major disappointment build implied episodes made feel like fart wind technical standpoint everything spot like cinematography far one best mcu good series could definitely better definitely good stepping stone phase,0.051,0.644,POSITIVE
2021-03-07,7,boring first last slow pointless episodes bad comics tv good acting justification character definition superhero changing u powers ultimately justified whatever way show wants,0.402,0.25,NEGATIVE
2021-03-21,8,stands others first episodes slow tension starts build turns really exciting show,0.146,0.221,POSITIVE
2021-05-22,10,come deserves ive seen everything marvel movies chronological order im huge fan boy ive found whole thing entertaining amazing entertaining wandavision something else different everyone used better mcu point predictable movies lost spark phase one brought ill go far say show best outing mcu effort,0.168,0.467,POSITIVE
2021-01-18,10,enter mcu multiverse refreshing experience long without mcu hint sci fi dash mysticism sprinkle true love romance show begins easter egg filled episodes sure deliver major plot twist payoff mcu phase officially begun lets get weird,0.037,0.283,POSITIVE
2021-03-07,10,marvel marvel blew minds away another amazing show best superhero show show full surprises thrill suspense comedy kat dennings darcy randall park jimmy treat eyes funniest part show kathryn hann agnes perfect paul bettany elizabeth olsen cute together mind blowing end credit scene excited dr strange multiverse madness,0.025,0.684,POSITIVE
2021-01-23,4,much filler enough plot seeing episode around 35mins long im finding mins useless banter coupled terrible canned laughter track maximum maybe 10mins actual plot per episode said plot actually happen enfold find mysterious entertaining hope writers decide make episode actual plot terrible wannabe sitcom fluff takes show case three episodes,0.245,0.128,NEGATIVE
2021-01-20,3,episodes care sure huge pay end isnt holding interest bother like different like new haircut without personality haircut,0.135,0.517,POSITIVE
2021-05-16,10,brilliant serie something special regular marvel content first couple episodes guessing theorising treat start finish acting incredible writing terrific characters beautifully well written superhero fans must see,0.0,0.718,POSITIVE
2021-01-15,1,incredibly disappointing never written review positive reviews forced hand first episodes dull forced boring unoriginal show would bomb fail fail bomb didnt mcu backing dont understand rating overall supposed comedy im assuming didnt even crack smile,0.579,0.101,NEGATIVE
2021-06-16,9,great beginning middle good end fantastic show every actor excellent job happy biggest fan mcu,0.0,0.871,POSITIVE
2021-02-18,1,tuned turned wife dislike elizabeth olsen already knew going painful watched first two episodes want hour back dont go gets better shouldve great right start also applies everything life,0.115,0.362,POSITIVE
2021-01-15,10,change superhero universe expect yes episodes released today people hate show much say boring wait till last episode judge sitcom still dont know marvel disney releasing episodes per week mandalorian something like things control wait next episodes,0.314,0.096,NEGATIVE
2021-06-19,10,loved show lot cliff hanging marvel show yet awesome story starting real bummer meant boomers amazing thank u marvel show,0.049,0.728,POSITIVE
2021-01-29,10,watch show anyone age probably difficult time appreciating show mix marvel x files brady bunch one better concepts marvel came well done,0.086,0.364,POSITIVE
2021-04-04,8,truely amazing incredible acting around really makes immersive experience one minute feel like youre watching sit com boom back marvel action,0.0,0.475,POSITIVE
2021-03-05,8,excellent show different mcu movies first doubts show kept proving episode episode wouldve given ending cliffhanger mean ive enough cliffhanger throughout whole show thought ending shouldve given closure fine show great enjoyable recommend anyone didnt watch cuz really awesome great idea good plot holes yeah thats,0.017,0.711,POSITIVE
2021-02-27,4,great expectations highly detailed carefully executed tv series unfortunately doesnt take risks jokes humor basically theres almost story well engineered disney sandwich level big screen marvel terms story telling,0.08,0.511,POSITIVE
2021-03-30,10,wow totally top well done didnt think going like got better better ws creative great performances,0.045,0.744,POSITIVE
2022-01-21,8,enjoyable refreshing something different although felt first two episodes dragged gimmick bit long chemistry wanda vision great see got first tv series end biggest surprise russia dvd box sets years ago,0.024,0.458,POSITIVE
2021-01-16,10,love show show amazing im never going look characters watching mcu film love seeing old style sitcom situations mystery behind unique mcu needs right good change pace cookie cutter stories weve gotten used,0.0,0.512,POSITIVE
2021-09-02,10,wandavision fantastic show every actor excellent job happy biggest fan mcu,0.0,0.836,POSITIVE
2021-02-14,9,wandavision episode first two episodes basically sitcom people would get turned next episodes good recommend watch,0.0,0.491,POSITIVE
2021-01-15,1,horrible funny worst marvel show ever created reading mixed reviews decided watch open mind ive long time marvel fan plus years show complete letdown show funny satire poorly written feels like cheap rip love lucy dream jeannie,0.461,0.243,NEGATIVE
2021-07-03,8,really fun different episode got better better revealing little week interesting love wandas acting vision great glad guys got spread wings good job,0.0,0.724,POSITIVE
2021-02-09,9,wow double wow class glass first three episodes drew watching american tv nostalgia entertaining plods along thinking heck watching made aware something right weird safe reality comes episode four cant say anymore fantastic marvel disney stand applaud,0.223,0.31,POSITIVE
2021-01-16,1,fell asleep watching sorry boring hell honor shows like love lucy bewitched bit pleasentville sadly insult instead honor thing also funny see star ratings came even release date,0.404,0.281,NEGATIVE
2021-04-02,7,great start okay finish wanda vision pretty good sitcom aspects fun seeing weird things happening affects unfold interesting show didnt finish particularly strong opinion last episode pretty good two werent good would definitely recommend watching,0.072,0.709,POSITIVE
2021-02-07,10,marvellous show compelling storytelling complex characters wandavision marvellous debut television mcu develop characters much meaningful ways add complexity storytelling expanding universe new uncharted territories wandavision surprisingly skilful emulating sitcoms decades setting tragedy witness later season show elevated another layer mystery including really pulling strings facade torn elizabeth olsen paul bettany blast olsen particularly stands one career best performances impatient viewers would suggest stop watching show weekly binge entire season episodes,0.108,0.273,POSITIVE
2021-02-20,3,boring boring figured would get better goes hasnt,0.786,0.0,NEGATIVE
2021-03-14,9,amazing mcu tv show watch mid post credit scenes big fan mcu show pretty awesome granted tv show really liked agents shield tied mcu films show tops also recommend set time watch least first episodes one sitting plus right available disney first bit slow paced might tend bit boring ideally starts making sense towards end episodes,0.106,0.449,POSITIVE
2021-01-15,7,marvel tried twilight zone skeptical hear marvel making shows enjoyed agents shield failed really impact storyline mcu said wandavision far pretty fascinating nice spin classic sitcom first two episodes love lucy type black white family show elizabeth olsen paul bettany fantastic duo perfect cast show really interesting creators able create personality otherwise side characters time screen together far best part commercials remind black mirror twilight zone episode im really excited see next combines spider man doctor strange,0.036,0.567,POSITIVE
2021-05-10,8,gotta love marvel universe started bit confusing lost interest bit last episodes cha hed everything really well done leads great finish hope season loose ends really love olsen bettany brilliant didnt think would like really grew glad stuck,0.193,0.576,POSITIVE
2021-01-16,1,expecting possibly due us didnt get show theres reason types shows dont exist didnt take uk love marvel dull get marvel wanted something bit different wasnt expecting like may well done run shows around years ago,0.178,0.168,NEGATIVE
2021-02-20,10,expect unexpected weird writing makes show unique epic,0.059,0.732,POSITIVE
2021-03-05,8,want marvel superb finale endgame lot us worried come next anymore stories tell yes yes covid gave us new marvel content year black widow kept delayed future mcu didnt look good marvel released gem disney plus wanda vision simple story woman mourning surrounds intricately layered mystery loving homage sitcoms center disney decided make genius move release episodes one week time keeping mystery intact leaving tons room speculation wandavision certainly isnt everyone quirky eccentric little corny sometimes dont blame anyone least shows plethora opportunities mcu move forward im glad marvel made bold choice im glad choice rewarded cant wait falcon winter soldier black widow loki spider man im sure wont disappoint,0.094,0.39,POSITIVE
2021-03-19,10,wandavision great fantastic show every actor excellent job happy biggest fan mcu,0.0,0.876,POSITIVE
2021-01-15,8,purdy good first two episodes see people say boring first two episodes arent gonna immediately hop action episodes meant like older shows cheesier know second one modeled bewitched ig well see happens next week intriguing show tho,0.158,0.382,POSITIVE
2021-05-29,10,classic marvel studios terrific series acclaimed marvel studios dont miss,0.0,0.793,POSITIVE
2021-01-25,9,funny first episodes 3rd better onwards brilliant stay managed get first episodes didnt find funny engaging silly hated small screen black white look fifties trying achieve fan especially spent several thousand pounds large screen tv failed hold attention gave first episodes star third stars hence score stars give one episode try third improve towards end must improve leaps bounds get watch anymore disappointed expected much much better marvel studios well even flop suppose paragraph review episodes 4th episode brilliant love stay making sense think disney realest first episodes together everyone would got hope theres another series follow stick folks,0.133,0.38,POSITIVE
