date,ratings,text,negative_score,positive_score,sentiment
2021-01-15,7,rewiew based episode marvel always things may look different start sometime story changes things changes episode building story boring episode boring something strange happenend end call fanboy yes im rating based first couple episodes know marvel loves giving surprises hope show ends well may change rating watching upcoming episodes episode sweet dreams made years wow wow didnt expected anything like yes look like starting getting interesting every episode changing rating expecting blast last episodeshopefully,0.215,0.327,POSITIVE
2021-07-07,9,thank mcu love many negative reviews beginning brilliant lovely served meal great starter innovation absolutely worked watched couple times felt good,0.0,0.814,POSITIVE
2021-08-22,10,amazing show literally everything suspense magic comedy acting amazing well please watch especially want remember every sitcom show since,0.0,0.701,POSITIVE
2021-01-16,1,watch lose attention easily first two episodes fail intriguing satire 20th century sitcoms brings back laugh tracks wonder mil per episode went,0.154,0.423,POSITIVE
2021-05-29,9,well written amazing actors fantastic show every actor excellent job happy biggest fan mcu,0.0,0.857,POSITIVE
2021-01-30,10,marvel haters atleast try love content despite coming marvel fans surely love people might fixed feelings episode marvel haters dceu fans might giving bad ratings ww84 disaster,0.361,0.371,POSITIVE
2021-03-03,10,exceeding expectation unlike movie format tv series format really allows characters shine get look different angles love fact show dares try experience new unusual way tell story understand frustration people first episodes personally fantastic dont go people expect makes interesting refreshing watch comes episode connects dots making whole experience much better meaningful series designed explain wanda power orgin potential become even powerful carrying relatable theme grief importance overcoming one best tv series ive seen recent years,0.05,0.413,POSITIVE
2021-02-08,10,shervin wandavision top bananas works weirdly entertaining way dont get negative reviews though watch trailers acting surprised watching dont get expecting didnt see wildly original show thats fun ride cant turn away absolutely pays end fantastic addition phase mcu elizabeth olsen amazing absolutely deserves emmy nomination cant wait see whats next,0.049,0.441,POSITIVE
2021-03-24,6,alright show could better needs story,0.0,0.0,NEGATIVE
2021-02-06,10,read watching reading star reviews understanding people lack knowledge reasoning show background story knowing isnt show meant funny sitcom much meaning story wanda avengers endgame tv show like incredibly unique entertaining though watch show need basic understanding storyline mcu otherwise may feel lost story find confusing points arent familiar mcu storyline havent enjoyed show rate show first impressions dont understand mind blowing extremely talented show never watched anything like,0.221,0.159,NEGATIVE
2021-02-08,10,awesome episodes wandavision disappointed cant wait whats come,0.333,0.485,POSITIVE
2021-01-15,10,awesome watched episodes like awesome elizabeth olsen steals show incredible move marvel ever,0.068,0.767,POSITIVE
2022-02-08,5,misses mark dont get wrong enduring years awful tv movies nice watch show genuinely tried elements payoffs sadly missed entertaining definitely good sure great,0.252,0.566,POSITIVE
2021-03-19,9,start watching start watching watch whole season quit,0.0,0.0,NEGATIVE
2021-07-14,10,wanda vision review show great definitely looking forward season,0.0,0.775,POSITIVE
2021-03-11,8,hidden gem yet already polished followed avengers saga must watch series started like usual sitcom evolution plot truly deserved series strong connecting bridge mcu also dont miss traditional post endings worth,0.0,0.317,POSITIVE
2021-01-16,1,ummmm know episodes god boring disappointing hopefully gets better feels like rip bewitched,0.481,0.247,NEGATIVE
2021-01-21,8,creepy fun special way recording funny content meanwhile u also feel bit creepy made even bette looking forward next episode,0.0,0.357,POSITIVE
2021-01-23,6,slow start great potential alright show could better needs story,0.0,0.64,POSITIVE
2021-01-15,1,million per episode result overhyped marvel fanboys best huge risk first episodes failed impress disappointed good thing elizabeth olsens acting,0.349,0.51,POSITIVE
2021-01-23,10,genius show amazing many levels three episodes managed subtly pay tribute make fun every major sitcom 50s 60s 70s clever intelligent ways yet somehow avengers subplot brewing deep inside giving away details slowly painful terribly addicting time overtly well cute harmless sitcom,0.1,0.518,POSITIVE
2021-01-29,10,reality bending sitcom show keeps getting better first episode bit slow starting episode mind blowing cant wait see goes,0.0,0.0,NEGATIVE
2021-01-15,9,amazing interesting star reviews calling star reviews fake hilarious everyone whats called opinion opinion show amazing usually shows takes little bit time get going dont judge harshly youve seen first two episodes thats really fair review love hate least wait youve seen,0.09,0.458,POSITIVE
2022-02-17,6,little bit action wandavision begins slow dont really know happening show doesnt even know action taking place clue fact know tv series happening sometime avengers endgame anyway soon episodes unfold find truth everything starts makes sense show bad great either funny emotional moments guess lacks action precisely dont get see action last episodes even main antagonist really threatening somehow show creates idea predictability know however strong villain end protagonist would always win wandavision bad ruin time especially guess important future mcus projects suggest watch prior mcus movies watching time mood lack patience guess movies captain america first avenger captain america winter soldier avengers age ultron captain america civil war avengers inifnity war avengers endgame enough order understand happening show dont forget credits scenes,0.256,0.19,NEGATIVE
2021-01-16,10,love great show far especially marvel fan,0.0,0.891,POSITIVE
2021-01-29,9,funny marvel series nudity profanity possible wanda vision disney first moden comedy noir marvel series seen little non far nudity horrible violence almost vulgarity since remakes style movies highly recommend still want keep ur communist netflix channel,0.356,0.246,NEGATIVE
2021-01-22,9,slow burn mystery cover sitcoms premiere ep1 review definitely fresh direction mcu definitely slow burn mystery interesting unique take sitcom style series format suits best elizabeth olsen paul bettany showcase talent time variation offered series overall first two episodes fans treat episode sitcom style remains takes step back story mcu continuity cements comedy holds played wandas powers abnormality feels like beginning story pay set first two episodes,0.014,0.436,POSITIVE
2021-01-23,10,garbage show cw wb seems low budget sitcom made teenage girls interesting exciting suspenseful interesting waste,0.461,0.249,NEGATIVE
2023-04-16,6,wandavision television series created jac schaeffer directed matt shakman starring elizabeth olsen paul bettany wanda maximoff aka scarlet witch vision respectively series takes place events avengers endgame follows wanda vision live seemingly perfect suburban life town westview however series progresses becomes clear seems one strengths wandavision unique format series pays homage classic sitcoms episode taking place different decade featuring different sitcom style approach could easily felt gimmicky forced instead serves clever way explore wanda visions character development olsen bettany deliver strong performances olsen particular showcasing range emotions wanda struggles grief trauma supporting cast also excellent standout performances teyonah parris monica rambeau kathryn hahn agatha harkness randall park jimmy woo series progresses becomes clear going simple sitcom homage series delves complex themes grief trauma power imagination testament writers directors able tackle weighty topics way feels organic never preachy series also features impressive visual effects cinematography use practical effects old school visual trickery adds charm sitcom homages surreal unsettling moments beautifully shot edited wandavision excellent series overall without flaws series pacing bit slow times early episodes feel like novelty fully fleshed story additionally series finale criticized feeling rushed fully delivering plot threads set earlier series despite criticisms wandavision standout entry marvel cinematic universe unique engaging television series series format strong performances exploration complex themes make must watch fans mcu anyone looking something bit different television viewing,0.073,0.363,POSITIVE
2021-01-16,1,theres obviously really obvious rather mystery meets eye made end first episode either waiting something beyond extraordinarily bad 50s sitcom pastiche didnt materialise tropes none jokes even bad ones confess soon begun fast forward second episode pausing snatches see tone going alter sort direction going emerge something would lift astonishingly tiresome affectation period without much way content really wanted like happened far sort extended setup extremely laboured one im sure sit another half hour cant life imagine enjoying grim turgid witlessly painful stuff far dont think disappointment actually id come without expectation dont think would watched ten minutes cant give away spoilers cant life say anything actually happened awful,0.292,0.052,NEGATIVE
2021-01-27,1,earth show make air manage ratings utterly pointless stupid every way,0.269,0.0,NEGATIVE
2021-01-15,10,breath fresh air something different something new marvel start shaking things else become old cant people embrace change people giving stars without seeing first obviously expecting twists turns throughout embrace something new keep open mind knows may even enjoy,0.116,0.221,POSITIVE
2021-05-01,5,driving cliff thelma louise style wandavision far one interesting experiences ive year long awaited primer marvel tv show show mcus new colors debuts solid presence flaunts unique concept contagious confidence series follows eponimous wanda maximoff vision traumatic runaway lives finds starring appears series american sitcoms cant say certain first show ever execute idea theming every episode around era television history cronologically going forwards every episode black white becomes technicolor clothing goes conservatist bombastically hippie first incarnation idea kudos marvel showrunners creating interesting concept still exciting wait every new episode wandavision still resulted mixed result series engages first second former third acts maintains dramatic momentum unique aesthetic era inspired comedy building tension mistery surrounding show performances praise worthy choice new returning characters fun casting surprises spotlight shine olsens bettannys play characters never clearly much fun possible process latter third act however things fall apart quite dramatically fact series surrenders much vision pun intended tap greater picture final episodes felt rushed unfinished grasping straws transitions back actual mcu tries needlessly subvert audiences expectations even daring throw away setup interesting side note special effects fall extremely short sometimes displaying gilmpses cringeworthy creative cinematgraphic cgi practices cw shows first gave show slack given thight budgets episodic formats today first episode falcon winter soldier released effectively aging wandavisions effects decade marvel seems willing make investments towards making shows film like quality special effects given exciting first part todays falcon episode seem denied wandavision commodities reason effects look par age ultron movie looked worse predecesor worst wandavision future mcu commercial less subtle actual timely mockmercials present every themed episode sequelitis slips cracks promising future productions instead present cohesiveness best however wandavision shows glimpses independant strenght makes wish dared stand prouder merit unique concept standalone production course still connected wider universe commited arc daring fully embrace love television cuz honestly dont love,0.088,0.324,POSITIVE
2021-01-15,1,smile never appeared face first episode absolutely interesting waiting loki guys,0.0,0.379,POSITIVE
2021-02-09,10,spectacular show marvel fans non marvel fans entertaining show ties mcu however feels away mcu times love mystery tv show genres show great,0.0,0.745,POSITIVE
2021-03-22,10,one best one best things marvel done elizabeth olsen paul bettany amazing im happy got flesh characters,0.0,0.832,POSITIVE
2021-01-15,7,astounding best thing marvel far shocks marvel taking massive risk show show far amazing episodes mysterious slowly get fascinating im dying advertisements awesome nods wandas character mcu fact episode recreated vibes decade astonishing episode two interesting moments,0.05,0.664,POSITIVE
2021-01-15,7,strange intriguing definitely far early say early episodes insane main story felt average funny goofy gaffs however certainly know building something big especially subtle hints thrown around subtly subtly show going slow burn going become lot better true marvel plot reveals disguise 20th century sitcoms,0.031,0.381,POSITIVE
2021-02-26,10,marvelous wooooooow exciting exceeding expectations bessstwowoow,0.0,0.64,POSITIVE
2021-05-19,5,great idea mediocre execution idea woman supernatural powers creates pocket universe takes form tv show episode different decade show makers get tribute styles 50s 60s 70s develop plot happening unfortunately big plot takes place hollywood superhero universe everything dumb predictable except inevitable big twist side dumb black white morality also none episodes good shows theyre paying homage makes think arent really golden age television best thing wandavision kathryn hahns performance nosy neighbor shes done lot stuff better,0.208,0.286,POSITIVE
2021-02-25,10,yes giving part clear hate watching trailers yes cant deny reluctant continue pilot first minutes chose give try right show magic starts slowly 50s sitcom mood good practical jokes turn insane story started decided worth time give second chance,0.059,0.495,POSITIVE
2021-01-15,10,weird funny goofy creepy oh god show weird good way expectations first episodes hilarious creepy moments mcu really take huge risk one unique superhero content,0.131,0.483,POSITIVE
2021-01-15,1,pale copie de sorciere bien aimee je ne comprends pas le de la serie la serie est surjouee de maniere intentionnelle mais cest pathetique et ennuyeux,0.0,0.0,NEGATIVE
2021-01-24,3,silly really ' get objective show totally silly nonsense front nowadays minds maybe would great ' com even year old child find interesting go forward,0.226,0.374,POSITIVE
2021-12-15,10,best marvel tv show show experience watch fun watch couldnt watch next episode soon enough huge marvel fan fun see would next marvel never really done anything like cool see going take show even energy around show everyone watching coming theories thought would happen episode catches attention didnt give back acting phenomenal definitely worth awards visuals also stunning usual marvel project way added plot every episode revealed last two episodes easy follow never expected happened finale leaves bit cliff hanger explains happened well still left wondering going know questions future wanda vision always favorite marvel tv show one favorite time tv shows,0.0,0.478,POSITIVE
2021-02-07,1,thanos save us incredibly horrible black white start slow boring cringiest garbage ive seen long long time nevermind minute credits end making think getting longer show actually nothing makes sense oo cant wait see happens kind way wth thinking writing trash kind way keep skimming episodes pass sitcom junk parts hoping blows wide open gets good nothing yet writers dont ditch gimmick show fall flatter pancake xmen movies great days future past quicksilver kitchen scene one best scenes movie ive ever seen epic going pull legendary x men movie quicksilver defunct avengers world really avengers mess disney mess disney absolutely ruining marvel universe thanos please put us misery dont struggle another episode,0.303,0.356,POSITIVE
2021-01-16,9,intriguing based two episodes available say show makes want know going makes curious balance tension comedy absolutely genius im looking forward watching next episodes,0.047,0.583,POSITIVE
2021-03-14,10,unbelievable could anybody ever expect marvel make emotional web series,0.0,0.47,POSITIVE
2022-05-22,8,wandavision episode filmed live studio audience episode dont touch dial episode colour episode interrupt program episode special episode episode new halloween spooktacular episode breaking fourth wall episode previously episode series finale,0.07,0.079,POSITIVE
2021-01-22,10,episode wandavision like nothing marvel ever done funny weird exciting entertaining loved every minute one strongest points fact thats something everyone enjoy marvel fan brings back old sitcom giving nostalgia old viewers keeps mystery front center younger viewers tones marvel easter eggs marvel fans enjoy show everyone thats fantastic also great performances elizabeth olsen paul bettany kathryn hahn,0.098,0.527,POSITIVE
2022-05-22,7,wandavision alright show could better needs story,0.0,0.0,NEGATIVE
2021-03-08,9,gets better better tbh first little annoyed setting ep01 best keeps getting crazy good last two episodes frggin well performed thanks marvel,0.079,0.669,POSITIVE
2021-03-05,3,started alright got stupid worst show ever needs development disappointed,0.835,0.0,NEGATIVE
2022-06-11,7,good show bad ending redeemed wandavision good show good job showing wandas depression ending kind killed saw doctor strange understanding shaw way setting knew stories people hate toxic theorists wanted x men show grow f,0.268,0.452,POSITIVE
2021-06-17,6,meh year goes w v im afraid theres one word describe ep boring got better ep tho villan motive lost like wanda world drama good though,0.31,0.287,NEGATIVE
2021-03-05,1,ignore reviews people work disney one hyped shows poor acting much plot easy spot villains simply boring fact early shows mimicked shows 1960s 1970s actually good magically transform show good spend time trying figure turning sound fake audience laughter laugh track starts favor watch something actually good note positive reviews people watch show work disney paid disney think reserve 10s citizen kane casablanca,0.2,0.377,POSITIVE
2021-03-12,1,huge grotesque wart mcu face bad bad many fans thinking maybe time give mcu break first episodes absolutely unwatchable meaningless stupid retro shows filler lack actual storyline save time slip episode even garbage unless youre witches rather superheroes,0.608,0.063,NEGATIVE
2021-04-14,10,must watch one best showes ever watched smooth quick show unexpected scenerios,0.0,0.656,POSITIVE
2021-03-06,10,love fantastic show every actor excellent job happy biggest fan mcu,0.0,0.865,POSITIVE
2021-03-05,9,brilliant best series ever made great experience watching hats mcu,0.0,0.892,POSITIVE
2022-01-30,1,surprisingly undermelming attracted great reviews expected really good show bored first episodes essentially old sitcoms bs watch speed bored death thought shouldnt base judgement episodes keep open mind persist thought would watched whole show episode episode waiting actual breakthrough something really thrilling interesting thought cant refusing grief well spoiler alert found writing lazy never really moved stakes protagonists face really feel like wasted time one disappointed obviously audience im part,0.213,0.376,POSITIVE
2021-01-29,10,disappointing show good many different ways slow drawn boring definitely good movies far watched four episodes removed bloat wouldnt even full min episode,0.25,0.434,POSITIVE
2021-07-28,1,arguably worst show ever watched arguably one worst shows ive ever seen took episode anything really happened even boring premise show dull reason finished high rating good reviews expecting something happen disappointed throughout fail understand earth many people like,0.637,0.115,NEGATIVE
2021-03-07,10,awesome season wanda vision season awesome loved initial episodes bit confusing slow dont stop watching till finale episode hope season well,0.16,0.651,POSITIVE
2021-06-22,2,torture watching every episode painful watching episode episode anticipating next one good think budget given leading two actors agree part bad tv show,0.361,0.274,NEGATIVE
2021-01-17,8,see reviews episodes many seems think show joke expect something traditional marvel show expected go watch something else marvel plenty pick think show far hits nailing sitcom aspect origin story show said wait judge series fully seen whole thing people way fast jump conclusion,0.0,0.16,POSITIVE
2021-01-24,2,boring first episodes didnt enough intrigue cut top frankly funny 60s sitcom satire couldnt keep attention marvel comic book show hit action might try season complete,0.45,0.135,NEGATIVE
2021-03-12,7,good great alright show could better needs story,0.0,0.818,POSITIVE
2021-01-16,2,show hard follow wish would explain got,0.154,0.297,POSITIVE
2021-01-26,10,waw amazing bringin back memories tv back evolin tellin story endgame connection doc strange ect poor girl suffering lost everything,0.239,0.31,POSITIVE
2021-01-16,8,omg minutes credits sums joke programme marvels lost step,0.153,0.513,POSITIVE
2021-02-28,5,like 12y kid really dont get gets atm lacks attention details depth plot put starts great main actors playing,0.0,0.559,POSITIVE
2021-01-17,4,episode changed mind still hate episode looking like dc universe choice votes tell everyone set whose job relies renewal bumping vote must people watched wonder woman thought good edit far episode given series bit hope time tell changed opinion episode,0.066,0.292,POSITIVE
2021-02-05,6,good one horrible 4th episode episode pretty good interesting characters character conflicts didnt like wandas bad guy speech though since wanda stop caring people need explanation,0.335,0.474,POSITIVE
2021-01-17,6,marvel avengers two powerful avengers living cheesy bewitched sitcom want see far massive marvel fan really bad fast forwarded try find something noteworthy episodes watch,0.275,0.237,NEGATIVE
2022-06-04,8,surprisingly good surprisingly good show takes time build mystery elizabeth olsen really gets shine great job wanda paul bettany great aswell two actors elevate show substancially thing found unnecessary shoe big cgi battle end could kept bit subtle opinion apart real emotional stakes invested action well done marvel,0.025,0.617,POSITIVE
2021-01-23,3,far nothing episodes nothing happened slow annoying ill probably watch season binge hopes getting better avoid slow drag wait,0.266,0.195,NEGATIVE
2021-01-16,1,sitcom minus jokes show sitcom without funny boring every episode last minutes watch minutes credits every minutes episode could find seconds something relatable mcu everything else bad jokes arent funny,0.294,0.277,NEGATIVE
2021-03-06,9,almost perfect marvel structured way marvel really outdid show beautiful torturous story grief trauma suffering additionally unafraid show grief drowns everything around left uncontrolled thing criticize marvels structure need make everything lead everything else fun beginning tiring significantly dragging last episode show expected complaining productive show leaves excited phase makes appreciate characters new level,0.246,0.398,POSITIVE
2021-02-02,10,watch amazing find true words explain good show,0.0,0.832,POSITIVE
2021-03-01,10,watch entire show writing review people need sit back give show shot writing review many star reviews based first episode honest enjoyed first episode also based trailer obvious show going stay black white etc highly recommend show,0.0,0.216,POSITIVE
2021-01-22,4,nothing see episodes nothing funny entertaining first episode kept watching hoping would get better didnt second episode also dry unoriginal could watch last ten minutes pretty much get story really hoping rest series something worth watching,0.106,0.235,POSITIVE
2021-01-16,10,bold brilliant step mcu im loving mystery aspect far expect well see reveal pay toward end also everyone complaining sitcom style expect massive fights starting episode every trailer shows filmed like sitcom underlying sinister tones far show delivered cant believe yall want mystery questions answered right series begins,0.136,0.396,POSITIVE
2021-03-07,10,agatha along meaning series marvel made excellent job first show hope completes ofc completing anyway awesomeness,0.0,0.673,POSITIVE
2021-01-15,1,rotten kind stupidity whatever hell want explain min b w crap horrible dont even think get better change rating,0.701,0.096,NEGATIVE
2021-01-25,10,beautifully crafted approaching genius fantastic show every actor excellent job happy biggest fan mcu,0.0,0.86,POSITIVE
2021-01-18,10,amazing dripping topical symbolism without preachy pretentious ep fantastic show every actor excellent job happy biggest fan mcu,0.0,0.787,POSITIVE
2021-01-16,1,incredibly faithful reproduction old sitcoms yet unlike originals unfunny uninteresting apparently might even go color tv episode three yay intent show work maybe supposed funny would rather scoop eyeballs spork watch another episode entertaining first two,0.0,0.311,POSITIVE
2021-03-20,1,hopefully get better im episode cant believe marvel fallen low disappointed ill give one episode thats actually subscribed disney plus could watch,0.467,0.123,NEGATIVE
2021-01-29,1,disappointed one worst shows every episode worse,0.898,0.0,NEGATIVE
2021-01-16,9,funny fantastic show every actor excellent job happy biggest fan mcu,0.0,0.862,POSITIVE
