date,ratings,text,negative_score,positive_score,sentiment
2022-09-30,9,terrific wandavision first disney shows take place mcu need start praise elizabeth olsen job shes beautiful shes underrated actress really one better actresses working right wanda one powerful superheroes entire mcu really shows weird fun show keep entertained throughout series attention detail really captured era fantastic tribute sitcoms era youre fan mcu must watch,0.02,0.516,POSITIVE
2023-01-31,9,elizabeth olsen amazing found wandavision pretty entertaining show thats fantastic addition phase top bananas works weirdly entertaining way start watching youll want binge quickly possible dont understand negative reviews though watch trailers acting surprised watching dont get expecting didnt get see wildly original show thats fun ride cant turn away absolutely pays end elizabeth olsen amazing absolutely deserved emmy nomination also great best thing going new dr strange movie,0.014,0.623,POSITIVE
2021-01-29,10,ignore every negative review episode might error disneys part release first episodes instead episodes people absolutely loved intrigue mystery first three episodes exceptional show getting lot hate due lack plot 4th episode came exceptional episode justified use first three even gave answers many questions wanda vision overall brilliant show shouldnt judged first three episodes especially complaint lack plot,0.111,0.577,POSITIVE
2022-10-18,7,unexpected experience first im marvel fan comics superheroes please read review outsiders point view watched show saw trailer obvious homage classic television appealed shows paid tribute mentioned like way main character related affected cast great humor lovely surprise villain well exactly cup tea said background universe wont go detail loved beyond words attention detail visible love expressed tv history dick van dyke show malcolm middle hit nerve made smile way love story included im still positively enthralled,0.097,0.398,POSITIVE
2021-03-13,8,missing emotions avengers wanda maximoff elizabeth olsen vision paul bettany somehow starring variations old tv sitcoms delivers missing emotional content avengers cinematic coupling never achieved actual feelings big screen movies wanda vision always felt slapped together dont much screen time even less emotions one brooding terrorist turned good robot humanized powerful magical beings rather human relationship time marvel decided expand probably interesting movie nine episode tv show expanding allowed various scenes give two character real human emotions places wandas grief front center well highlighting relationship movies show puts real meat bones characters finally makes flesh blood warning least watch episode four surreal first three episodes confusing leave one wondering unfamiliar sitcom tropes,0.184,0.192,POSITIVE
2021-02-06,8,wandavision kewl show developing nicely although build slow episode story progresses gets interesting world building seems good characters solid theres eerie vibe every episode makes intriguing also show somewhat different many double meanings implications feel free interpret wandavision already pun another note happy see many actors various mcu films appearing also core cast show pretty good see kathryn hahn olsenbettany given nice chance show acting skills deliver comedy top drama action used looks like novel show give go,0.019,0.512,POSITIVE
2021-02-04,10,gets better every episode fantastic show every actor excellent job happy biggest fan mcu,0.0,0.787,POSITIVE
2021-03-10,7,bad say good others say alright show could better needs story,0.355,0.355,NEGATIVE
2023-02-26,8,refreshingly creative refreshing creative television series series first two episodes almost sluggishly slow later pick speed breaking new immersive ground superhero genre somewhat difficult understand first quite unexpected funny enjoyable comedic nature series eventually makes way dramatic superhero action heart wrenching end various plot themes past television comedy series mysterious military thrillers paranormal powers border magic make difficult script writing effort script though almost nearly becomes seamless continuous television experience use flashbacks editing times become worrisome approach actually somehow redeem quite well intentions reflective great scriptwriting loose ends almost magically come together many storylines explained offering nice understanding individual characters fit overall series becomes edgy eventually introduces emotionally charged philosophical humanistic quandaries definitely worth watching,0.066,0.368,POSITIVE
2021-03-05,8,comic book geek hand help fill blanks person like fantastic show every actor excellent job happy biggest fan mcu,0.029,0.781,POSITIVE
2021-02-23,5,interesting premise boring padding wandavision certainly intriguing premise pretty much everything else like build interesting parts tacky snore first three episodes pretty much homage old sit coms unfortunately werent able make parts know funny merely function boring transportation device mentioned interesting parts couldnt hire actual funny sit com writers parts make good instead necessities unfortunately intriguing serious parts kicks ins feels like even parts show gets stuck kind stale combination feel like ah go doesnt really go suppose funny still serious either way good things,0.182,0.466,POSITIVE
2021-03-22,4,interesting concept overall mediocre show could lot interesting unfortunately another mediocre overrated show concept isnt bad series boring despite episodes short seem long last two episodes arent bad enough make series anything mediocre entertainment isnt really worth spending time today hows unimaginative boring one exception maybe many movies series superheroes nothing impress us anymore cast good shame script isnt good cinematography excellent simply enough anymore special effects enough make show interesting unfortunately another series mediocre generic tv shows short another mediocre show slightly better special effects,0.226,0.404,POSITIVE
2021-02-03,9,hype well deserved ive become little suspicious called hyped shows sheer surprise wandavision really great show need stick first episodes bit chore settles pretty much episode four becomes cracking watch rather difficult review show whole quality episode vary little however sheer imagination acting general originality score dont put first couple really go notch delivers,0.062,0.31,POSITIVE
2021-02-21,6,alright im sorry review ive watching amazing opinion star shows doesnt seem great watch next coming episode yes probably watch much tv free time love movies shows casting reviews think olsen great maybe needs bigger challenge probably one someday alright decent show entertains moment watching opinion theres nothing spectacular thought provoking like shows ive watched elsewhere thanks reading sina,0.344,0.274,NEGATIVE
2021-03-05,5,finally knew last episode would want give series doesnt deserve great finale episodes midway enjoyable quality slipped seemed episodes filler material plot annoying due low run time episodes limited series exception ep think lot hype around fan theories happened every week fun show tbh fact mcu watch tie movieson plus side great episodes great start end upsetting quality could episodes know string along show week week huge epic payout wasnt even im hater show feel could much better people want know main parts movies id watch last episodes,0.332,0.212,NEGATIVE
2021-01-15,10,credits way long two episodes im hooked excited things unfold minutes credits bad joke time better used content show,0.318,0.277,NEGATIVE
2021-01-25,5,overwhelmly dull sitcom bits arent funny mystery isnt mysterious ive watched ep idea lasted long,0.282,0.0,NEGATIVE
2021-04-18,2,wandavision bad tv literally wanted like show first minutes nonsense eternity nothing happen tv follows mostly badly written show pretty lame final showdown feel actors well roles really unheroic things show respect tried something interesting star trek tng episode similar plot alien built paradise dead loved one much better tv show makes want watch marvel tv,0.372,0.239,NEGATIVE
2021-01-16,9,give almost quit watching halfway first episode seemed kind silly top however changes show starts take dark perhaps sinister undertones think series mystery slowly starts unravel episode,0.118,0.157,POSITIVE
2022-06-18,8,one best things marvel done fantastic show every actor excellent job happy biggest fan mcu,0.0,0.866,POSITIVE
2021-04-08,6,overhyped average show starts slow bit strange story starts improve gets good well agatha harkness whole story becomes stupid need ok road going always need dumb twist dumb spoiled whole story,0.338,0.293,NEGATIVE
2021-02-08,9,wow wow wow wow wow wow bear first episodes find crazy creative tv show almost gave wondering happened marvel studio made many amazing movies 4th episode came explained complicated story absolutely innovative tv show chance seen something like hold marvel theyre trying something new tv shows bold try wont let stars cos end credits last crazy long mins sweating,0.044,0.575,POSITIVE
2021-03-26,5,somewhat acquired taste required sat watch series wandavision told really good also high rating imdb seemed deem great show creative force marvel behind could possibly go wrong well admit wandavision fell somewhat short properly entertaining whole concept storyline threw found hard buy take seriously oh sure wasnt really bad didnt really appeal much yet managed endure episodes watch end granted also said overly keen whole concept superheroes still watch tend somewhat entertaining albeit often mindless entertainment said literally suffer half show things start become interesting escalate definitely something killed show well visually wandavision would expect marvel production lots high end special effects great sets props wonderful costumes cgi effects throughout course episodes spectacular tends stuff comes marvel studios wandavision great ensemble cast members definitely blast elizabeth olsen paul bettany return reprise roles wanda maximoff vision respectively aside series also amazing performance kathryn hahn really impressed quite lot series much generic comedy actress say kathryn hahn actually makes show quite durable watch also blast see actress debra jo rupp show really wanted like series submerge difficult especially first episodes well ridiculous lack better words must admit though last episode quite interesting little late rating wandavision settles mediocre five ten stars shows storyline plot swing miss visuals acting performances made bearable sit however sure show appealing hardcore fans marvel universe mean look rating show,0.064,0.502,POSITIVE
2022-04-02,8,give chance great series first three episodes little strange gets really good things explained turns great marvel series really good characters introduced interesting story worth watch,0.016,0.778,POSITIVE
2023-06-28,8,comfortably numb fantastic show every actor excellent job happy biggest fan mcu,0.045,0.822,POSITIVE
2022-03-19,10,woah one best pieces marvel tv weve gotten years aware mcu viewing yes definitely youre youll confused ive heard much hype show lot mixed reviews didnt really look interesting watching every episode opinion gone way unpopular opinion lowkey better big portion mcu including iron man wandavision one best compelling mysteries ive ever seen tv show first frame feel something definitely wrong director great vision wanted figure things show went revealing everything elizabeth olsen paul bettany best acting since infinity war kathryn hahn incredible show fantastic see real threat wanda show took wanda vision dark directions vision philosophical debate one best things ive ever seen mcu shows episodes amount one best epic finales ive seen long time might surprising people hear wandavision gets,0.052,0.608,POSITIVE
2021-03-07,5,marvel fans stop inflating mediocre series disclaimer hate marvel speaking objectively fan cinema tv personal vendetta marvel one line stuck series uttered background character begs please let us go sentiment feel marvels vice like grip cinema television content releasing less often greater polish rather spewing shows films like theyre going style wandavision simply put bang average par television mismatch clunky scripting ailing plot akin lower end marvel tv show predecessors see agents h e l staggering think expensive series ever reason think lowly initially admit invested first two episodes complete rubbish wasting hour time two minutes storyline hint enough persevere episodes three four interest peaked story began unfold awful dialogue something actually unfolding fun stopped rest series devolves comically bad television predictable uninspired hidden niche references hardcore fans accessible average viewer instead get vfx wouldnt look place early 2000s along acting described bad except paul bettany really trying damnedest funding show really 25m per episode honestly say looked good game thrones example episodes twice long wandavision ten times settings required lower budget yet looked worlds better cringeworthy witch fest fight scenes bemusing given clunky physics weird cuts used enhance action understand attempt bringing back sitcom styles 50s forwards like novelty wears nothing else interest show reality wandavision disneys mandalorian marvel universe sacrilege superhero fans enjoy spectacles aimed assimilate shows even rubbish show unconnected marvel fact new troop superheroes plot acting wouldnt heard celebrated begin swaying power marvel days would say watched take rose tinted glasses watch series honestly frankly really say pinnacle television best say different even individuality lost second half,0.251,0.216,NEGATIVE
2021-04-17,4,worst insanely overrated first episodes still mystery peak episodes even progressed abundance mind numbing sitcom skits soon big twist revealed got really bad feel like couldnt live built earlier wasnt awful though still good moments like every show typically,0.448,0.246,NEGATIVE
2021-02-15,10,kidding negative reviews show beautiful funny first minute looking forward evolve,0.0,0.506,POSITIVE
2021-03-06,5,slow start decent middle flat finish good acting first episodes quirky uninteresting middle set episodes improvement clear something else going marvel might take risk went right back formula ruined moving comfort zone interesting character potentialbut olsen bettany fantastic,0.07,0.543,POSITIVE
2021-03-11,6,pure set next mcu movie instead creating world cinematic climax avengers marvel reached pinnacle excitement despite big plans movies spread needed something fill space seeing success mandalorian mickey mouse empire decided try approach superheroes wandavision came attempted create mystique using black white sitcom style unfortunately neither flat jokes quirky atmosphere made interesting episodes went events began make sense teasers place series became rather enjoyable episode everything going upwards show looked like might actually something big crack open next phase mcu bombed ending resolution manage wrap story alright fashion much potential make dramatic truly emotional climax instead went usual disney ending without real weight mention countless red herrings amounted absolutely nothing second post credit scene add pepper new costume looked sick show could much marvel needs understand series satisfying conclusion mere set movies show certainly turned better expected manage get past initial episodes enjoyable binge elizabeth paul put lot effort acting vfx look formidable wish writers would tried harder think series questions left unanswered frustrated get quite simply episodes one time watch made fill gap movies instead creating interesting project fans would genuinely care movies shmovies instagram,0.065,0.221,POSITIVE
2021-01-15,8,many questions people need pay attention fantastic show every actor excellent job happy biggest fan mcu,0.026,0.752,POSITIVE
2021-03-22,7,liked non marvel episodes im marvel fan liked first episodes simply marveled idea kinda original although watched something similar mr robot elliot old comedy show laughters background felt like idea especially beginning liked twist end laughed lot,0.0,0.502,POSITIVE
2021-11-21,9,amazing series first series funny moments expected marvel series mysterious mysteries solved last episode make hold series suspense also story plotting character development fantastic cant describe credit scenes also epic problems well like familiar english language series uses hard words feel boring start bcz sitcom type mistakes well little bit confusing also thats hope like,0.224,0.498,POSITIVE
2022-01-10,7,wanda love gotta vis wandavision picks time events avengers endgame initially presents sitcom makes first two episodes little difficult engage theyre fun enough right dont exactly grip series progresses though soon reveals strong overarching narrative thats actually really meta fairly interesting way episodes even clearly part wider story styled sitcoms decade starting 1950s ending 2010s show less drops conceit finale finale actually rather underwhelming introduces antagonistic force doesnt follow established throughout show still affair focused character thats really shines sure cool see adapt desired story fit within sitcom framework impactful stuff certainly comes characters question reality shown dealing ramifications events underwent previous big screen appearances though gets bit rocky start well made entertaining show also rather distinct explores title characters better marvels previous efforts good start television side mcu,0.029,0.311,POSITIVE
2021-01-16,5,kind hokey bad good ok alright show could better needs story,0.318,0.48,POSITIVE
2021-05-07,8,get little dog fantastic show every actor excellent job happy biggest fan mcu,0.0,0.802,POSITIVE
2021-03-07,6,potential great ok really loved first three episodes different wasnt typical marvel formula isnt bad thing action fake science talk bit creepy times genuinely enjoyable watch course episodes people criticized boring using sitcom tropes well point episodes using sitcom tropes putting twist watch didnt anyways start see typical mcu stuff without action get fake science talk like jimmy woo though villains bad especially one worked w r cant even remember name much fake science talk lot time spent outside sitcom style sitcom style bits really fun thats first three episodes great also action show wasnt needed really didnt want show big action packed climax kidding marvel show first three episodes rest id say averages overall,0.17,0.361,POSITIVE
2021-01-15,8,delightful superhero soap unlike anything mcu part loving whimsical homage classic tv history part tantalizing kilter mystery wandavision wonderfully weird strikingly bold step small screen mcu perfect showcase elizabeth olsen paul bettany marvel goes bizarre audacious twists world away usual explosions super punching yet confidently delivered tangent bringing back familiar characters fresh imaginative way elizabeth olsen paul bettany deliver comedic goodies series drops delightful comic book easter eggs mystery unfolds towards phase mcu watching first two episodes proved show definitely expertly produced spectacularly written beautifully performed twists tv history olsen bettany commit hard cheesy comedy wandavision extraordinarily different aspect superhero genre,0.035,0.441,POSITIVE
2021-01-17,10,double meanings everywhere fantastic show every actor excellent job happy biggest fan mcu,0.0,0.803,POSITIVE
2021-03-07,10,take eyes westview new jersey present day charming suburb full happy couples men gainfully employed every woman ideal wife even one person causing problems worst thing say anyone living enjoy gossip things past tragic newlywed wanda olsen channeling mary tyler moore elizabeth montgomery lucille ball surely things perfect completely without conflict pain moved darling husband vision bettany dick van dyke hugh laurie fit children well behaved finally time together however mean risk sounding distasteful last time saw head happened everyone smiling much making corny jokes time didnt things used colour black white mean didnt know better would almost say feels like twisted role play everything like sitcom decade catchy theme tune opening seems keep changing every often crack facade easily least mainstream experimental furthest away well known depending ask less maligned house style seen mcu far ways feels like made david lynch something youd see twilight zone mystery incredibly compelling know immediately something definitely wrong since people making completely aware trying figure actually going carefully looking indication put countless clues glued screen listening carefully references comic books movies tv shows trying figure ones easter eggs ones telling us happening hitting google youtube see missed talking friends coworkers theories convincing people werent already watching participate course exactly people behind hoped would happen amazing job every cast member spot complex layered performances considering spans half century shows clearly huge appreciation herculean feat clearly homework matched writers costume department set design cinematography keep mind every often feature real nightmare fuel recommend fans marvel television series love letter,0.098,0.326,POSITIVE
2021-03-06,7,interesting really cool different show starring characters im already invested great time part filled intrigue mostly pays debating went first episodes didnt hook much one major disappointment subplot involving outside character cant make logical sense many points absolutely loving mystery intrigue viewings,0.038,0.554,POSITIVE
2021-02-01,10,disney dropped episodes would get less reason one would give series less idea coming disneys fault learn netflix dropped episodes america loves binge watching watch first episodes like garbage patient virtue well rewarded starts end episode realize really going show,0.225,0.234,POSITIVE
2021-03-06,10,true vision aware mcu watching three phases came yes even starts like old time sitcom show even knowledge two main titular characters paramount pun intended also maybe next studio disney buys course enjoyed even aware anything prior even seems much think rewarding go catalog course werent fan likely wont become fan especially patient enough might give show first episodes youll missing quite something marvel took calculated risk go back time manner cherished shows enjoy taken back different time rejoice especially done much love care upcoming making shine light already aware mid credit scenes become thing episode onwards three episodes added scene last one even two scenes really make love show want know seems anything resolved taken future mcu movie phase enough callbacks people returning roles also many new characters introduced people aware comics may ideas going even guess certain twists show considered long marvel movie well made enough everything keep viewers edge seat wanda see vision rewarding puns intended,0.022,0.298,POSITIVE
2021-02-12,8,short ended began interesting fantastic show every actor excellent job happy biggest fan mcu,0.0,0.813,POSITIVE
2022-02-26,8,best marvel disney show refreshing see something different mcu sitcoms segments especially first three episodes gold made revelations much effective couldve ever hoped moments expositions bit much still worked pretty well elizabeth olsen paul bettany mesmerizing watch even though wasted castings good see elaborate fan theories fail wanda became one explored characters mcu one probably explored little couldve tony stark years retcons inconsistencies however wandavision still lot potential become truly great bar mcu set wont allow obscure still even pleasant surprise way bent realities tried dabble boundaries surrealism quite reaching,0.054,0.464,POSITIVE
2021-09-05,9,one best series frm marvel except first two episode series awsm give series star 1star remove frst two episode wanda u r amazing love,0.0,0.684,POSITIVE
2023-02-15,9,best mcu show made show pure entertainment art star finish admittedly youre sitcoms may like show love sitcoms already right alley sitcom meets twilight zone meets mcu meets romantic tragedy story wanda vision justice endgame didnt time grand scheme things acting amazing sets costumes beautiful script chefs kiss mention meta casting choice ralph actually cant think single con show pretty pissed doctor strange wanda character development,0.09,0.485,POSITIVE
2022-08-25,6,creative awkward marvel hasnt quite gotten shows right episodes bit overstretched much happening episode lot forced humour extremely jarring awkward importantly lacks unifying soul feel much like people acting like real story real people,0.111,0.439,POSITIVE
2021-03-06,8,mcu expands television fantastic show every actor excellent job happy biggest fan mcu,0.0,0.824,POSITIVE
2022-06-23,9,answer show fantastic show every actor excellent job happy biggest fan mcu,0.0,0.819,POSITIVE
2021-12-18,10,much lives illusion fantastic show every actor excellent job happy biggest fan mcu,0.0,0.803,POSITIVE
2021-01-31,10,played dangerous game rating show stands direct result first episodes like everyone else like world first episodes basically given forced watch 4th outing oh boy worth wait went joke solid couple minutes yes think dangerous game play studio even though somehow felt couldnt think lot people given shame ep know going great show high quality storyline great actors cant wait next one,0.111,0.454,POSITIVE
2021-08-09,8,good marvel wanted something different liked,0.0,0.847,POSITIVE
2021-03-08,5,super average rate disney shills started good really enjoyed slow burn mystery episode turns average marvel flick lots flying around cgi fight scenes leave detached action lots unexplained plot points boredom plus side long much time wasted sure watch nothing special,0.196,0.354,POSITIVE
