date,ratings,text,negative_score,positive_score,sentiment
2021-08-04,7,pretty good could better seen entire series say wandavision great episodes awful ones incredible ones well episode one best episodes tv ever seen mockumentary one one worst main problem found liking pleasentville truman show fallout vibe episodes one two moved form 50s 60s 70s felt overall vibe decade made less sense show get lost formula format documentary episode office terrible awful think one sitcom episode less show wouldve perfect loved design vision end wandas character moved well though agatha wasnt great villain hayward felt like missed opportunity shouldve done spectrum deserved show feels tacked wouldve paid good money watch monica rambau tv series randall park funny woo falls little flat completely solid appreciate breaks mold wish either broke even feels like wants different revert back mcu formula,0.194,0.468,POSITIVE
2021-01-23,9,slow build excellent little slow developing patient rewarded knowledge source material probably loving easter eggs familiar happening hang worth wait,0.0,0.652,POSITIVE
2021-01-15,10,remember episodes reviewing show episodes supposed cheesy shes sitcom basically also episodes show getting started beginning wait later episodes action packed,0.0,0.0,NEGATIVE
2021-01-15,10,keep watching know started way know wanda created universe together vison reality slow start falter keep watching see unfolds first two episodes hard get,0.055,0.079,POSITIVE
2021-03-19,10,perfect show may slow start definitely one unique things ever come mcu pretty experimental definitely worth end people disappointed focused random theories going instead purely enjoying show unanswered questions like end wandas story since see multiverse madness possibly next spiderman film,0.163,0.473,POSITIVE
2022-07-26,10,best mcu show ever ok story characters story unveiled absolutely phenomenal entire cast worked extremely hard delivered dont anything else say also duo agatha wanda best mcu ever seen,0.024,0.623,POSITIVE
2021-10-03,8,drama comedy action thriller romantic everything need series must watch series marvel fan connects endgame multiverse,0.0,0.439,POSITIVE
2021-01-15,1,boring marvel becoming overrated horrendous,0.872,0.095,NEGATIVE
2021-03-20,7,wandavision really fun series enjoyed watching first last episodes weakest series still excellent series series annoying errors answering questions acting story series best mcu rating series,0.11,0.642,POSITIVE
2021-01-15,1,boring sitcom single joke landed first episode laugh track genuinely would never assume meant jokes,0.369,0.262,NEGATIVE
2021-02-15,10,wow show slow build worth ive never blown away show also love brought darcy kat dennings back everyone phenomenal well done marvel,0.0,0.465,POSITIVE
2021-01-17,8,think skip one seems skipping episodes say show feel booerd watching tried hard keep watching show could phone insted watching youtube dont understand people rating really close give beacuse production good dont feel marvel sitcom brand feel update ok show great wrong,0.095,0.405,POSITIVE
2021-04-10,8,gets better better dont give first episode comes together great addition marvel family,0.0,0.631,POSITIVE
2021-01-17,2,everyone says need watch closely better yet watch boring dry understand going seems like using mcu draw fans bad series,0.53,0.06,NEGATIVE
2021-01-15,1,insult intelligence generation american sitcom revival good fifties sixties original scripts popularity lucille ball co nothing original marvel thinking oh wait minute disney executives nostalgia without ads,0.119,0.46,POSITIVE
2021-03-13,7,innovative ultimately boring get idea interesting innovative good marvel come execution though somewhat missing relying sitcoms format throughout season really dragged plot compelling enough give full attention bored sitcoms wanted keep watching see conclusion show also learned happening episode rather pointless continue dragging oblivion sitcom blackhole,0.214,0.318,POSITIVE
2021-03-12,9,one best creative things marvel done fantastic show every actor excellent job happy biggest fan mcu,0.0,0.883,POSITIVE
2021-01-15,9,well shows boring hope gets better soon,0.55,0.25,NEGATIVE
2021-05-09,9,powerful mini series reluctant watch first saw trailers superhero stories gotten little stale glad finally mini series put great new spin superhero genre took new dimension acting point main characters likeable story orginal wondering hell going first episodes figure youll enjoy rest ride,0.094,0.394,POSITIVE
2021-02-21,8,far good like better luke cage defenders punisher interesting storyline twists turns think people enjoy marvel tv shows,0.078,0.628,POSITIVE
2021-04-01,8,marvel takes us places never thought would possible hardcore comic book fan much watch movies average reader read house good book never thought ther would time marvel adapt mcu show mysterious probably main reason glued episode answers question leaving dozens questions elizabeth phenomenal performance wanda vision new favorite couple oh watch episode,0.0,0.315,POSITIVE
2021-04-17,9,wow clever fresh original fantastic show every actor excellent job happy biggest fan mcu,0.0,0.882,POSITIVE
2022-07-11,9,simply amazing dont know whether give full arguably one best mcu shows history episode better last humor needed great really good show confusing mysterious first episode really confusing plot made sense episode full circle episode awesome episode best one episode finale second best didnt know expect idea happening brief thought could house like storyline wanda never displayed reality warping powers surprise really liked best start phase reason didnt give full obvious disappointing ralph boner joke tease amazing reveal kinda ruined mood bit ending costume post credits set lot overall one best shows mcu even overall fandom shows history,0.112,0.629,POSITIVE
2021-03-27,9,must watch series fantastic show every actor excellent job happy biggest fan mcu,0.0,0.803,POSITIVE
2021-03-07,8,awesome paul bettany grear story fresh fabulous direction really good,0.0,0.846,POSITIVE
2021-03-03,8,need know mu enjoy mu fanatic yes ive seen movies didnt watch tv shows read comic books probably advantageous know backstories characters thoroughly enjoyed episodes wandavision much interesting good show like others said took bit determination get first episodes sticking really paid show good many reasons wandavision skeptical watching say totally worth watching show good anything else new right youll thank later,0.021,0.529,POSITIVE
2021-01-29,8,marvelous based episode watched far call art acting couldnt better story mind blowing im speechless far,0.0,0.206,POSITIVE
2021-02-27,10,love amazing fanatic masterpiece watched episodes tv series liked tv series much marvels best tv series lot fun watching tv series,0.0,0.779,POSITIVE
2021-05-28,7,unique show ends typical marvel first episodes hooked series every episode hanging edge chair looked forward new episodes episode came like mcu project shame series unique one favorite things mcu would nine give eight,0.075,0.2,POSITIVE
2021-03-25,7,wanda time shine wanda maximoff vision two characters mcu lot potential never got character development deserved finally show wanda probably tragic character mcu finally deals grief loss elizabeth olsen phenomenal wanda imitating characters different era tv shows constantly balancing line good evil paul bettany great always chemistry love really establish wandavision best mcu couple rest cast good final episode kind letdown sitcom style episodes lot fun unsettling well looking forward rest marvel shows,0.067,0.524,POSITIVE
2021-09-29,7,fun intriguing dragged uninteresting b plot lacklustre climax wandavision marvel studios first venture television exclusively made disney story picks sometime avengers endgame wanda vision living quaint suburban area however begin suspect everything seems wandavision stars elizabeth olsen titular character wanda maximoff alongside paul bettany plays love interest vision like seeing teasers wandavision left curious black white old 60s styled sitcom vision alive questions eventually answered show interest even someone doesnt claim biggest fan marvel cinematic universe getting taste twos romance previous mcu films surprise olsen bettany play well wanda compassionate one wants live quiet life nuclear family vision calculated philosophical love interest always tries right thing pairs chemistry believable helps move story along even things start become strange sense mystery early parts show one intriguing promotes many questions seen across different social media platforms week fans trying uncover exactly going westview although explained near latter half series may satisfy creative theories one didnt mind plot went thought made sense without spoilers paints character wanda tragic figure whereby actions understandable however easily scrutinized biggest problems lie show b plot climax understand secondary story vital explaining whats going outside world however never really found interesting fact found really divert momentum points take experience leading times felt like checking time often apparent episode show least favourite moments story shifted outside westview found clarification real world bled world fairly anticlimactic given set speaking climax final episode wandavision really lost enjoyed twist explanations given going point wouldnt mcu pinnacle point story didnt divulge sequence cgi action wish show could wrapped quiet less chaotic way understand leading conflict however conflict ended marvel trope loud brightly coloured action frankly disappointing doesnt totally ruin show detract overall experience considering show built overall wandavision decent ride loved technical features show transitioning various aspect ratios little attention detail given time period episodes paying homage well crafted show point story intriguing sets satisfying enough pay even plot points get monotonous climax rather underwhelming still recommend wandavision sufficiently good show im sure lend greater mcu story hand reason giving wandavision,0.048,0.356,POSITIVE
2021-03-05,8,simple incredible marvel really hit park wanda vision first time anyone tried something like amazing definitely must watch,0.0,0.618,POSITIVE
2021-02-15,9,shows definite promise seems like lot reviewers expect everything handed plate dont let disney logo fool folks marvel lot comments suggest doesnt get going fourth episode well strong hairs back neck moment episode geraldine let something slipi given nine stars ive seen far may raise ive seen right episode come,0.048,0.248,POSITIVE
2021-03-08,8,marvel newest step forward fantastic show every actor excellent job happy biggest fan mcu,0.0,0.813,POSITIVE
2021-03-07,6,meet expectations mean theres nothing say first three episodes boring hell messed finale like simple even classic sitcoms interesting could end three four episodes wonder whats meaning pulling long,0.381,0.11,NEGATIVE
2021-01-30,9,hear people watch regretted lot persons say id bad stuff honestly feel like beginning change people star telling lazy end tjapphat isnt actually fault ones believe every theori pop watch enjoy,0.315,0.215,NEGATIVE
2021-03-29,9,captivating viewed disney first slate mcu miniseries hitting disney follows avengers wanda maximoff scarlet witch vision introduced avengers age ultron standalone adventure set events avengers endgame two find trapped reality based classic sitcoms years gone thats centered day day life husband wife wasnt sure think going first couple episodes kind slow though unique franchise things start unravel slowly start see bigger picture becomes completely gripping experience dont typically binge watch series short time found chewing weekend completely captivated weaving narrative furthermore thought cool aped low fi special effects classic sitcoms bewitched superpowers earlier episodes allowed stick theme save effects budget big happenings later episodes enjoyed references sitcoms grew watching like malcolm middle later half,0.073,0.181,POSITIVE
2021-01-19,10,please seen episodes waiting long time show drop unlike ive waited days watch first episodes although reading reviews odd youtube non spoiler video theorys storylines likely followed really cant understand negative reviews based two episodes especially show thats going based progressive fantasy based world wish watchers would understand see episode episode take limited camera angles sparsely decorated set compared next episode please give chance marvel arent going unleash endgame style blockbuster via tv show show designed build feed future movie doubt marvel tv shows theyre simply way fill time mcu fans wait get fix,0.079,0.181,POSITIVE
2021-02-16,10,good show starts slow since ep4 gotten times better give chance wont regret,0.0,0.605,POSITIVE
2021-03-07,1,literally dumber worst show ever needs development disappointed,0.873,0.0,NEGATIVE
2021-01-15,9,baffling bizarre im rating first two episodes impressive feat melding mcu 50s style sit com humor time stories era look underneath youll start see something else darker portent glimpses pure sifi fantastic start wackos assume good reviews sponsored think,0.033,0.472,POSITIVE
2021-01-17,8,far good fantastic show every actor excellent job happy biggest fan mcu,0.0,0.866,POSITIVE
2021-01-15,7,point point show im two episodes nothing early 1960s sitcom writing awful real special effects doesnt even temped come back watch next episode whats minutes credits end certainly people work,0.247,0.17,NEGATIVE
2021-08-02,7,great weird alright show could better needs story,0.072,0.675,POSITIVE
2021-01-16,8,weird wanting see happens pretty weird get something gets interesting left wanting see happens next however wish little weird nuggets frequent slow build im sure itll worth,0.138,0.347,POSITIVE
2021-03-05,8,good unique take watching show confusing going like direction going episodes goes started learn whats happening shocking answers twists love wandavision something new never seen marvel think say aboard however much enjoyed series cant feel like plotholes episodes get ending expectations high execution disappointing dont mind predictable things happening dont like turns generic despite like mystery show characters think im going take break mcu awhile,0.154,0.372,POSITIVE
2021-03-19,10,one best series ever watched wanda vision like watching buffy first time every episode brillant havent enjoyed tv series long time like wanda vision yearly viewing enjoyed much,0.096,0.532,POSITIVE
2021-04-02,9,magical mysterious fantastic show every actor excellent job happy biggest fan mcu,0.0,0.819,POSITIVE
2021-03-06,3,time waste sure go ahead watch episodes ive one blame getting sucked hype series disneys handling mcu general like buying bag potato chips packaging cost contents bag mostly air case wandavision potato chips didnt taste good stale,0.317,0.092,NEGATIVE
2021-01-24,3,epi worst show ever needs development disappointed,0.865,0.0,NEGATIVE
2021-01-15,10,review bombs unfortunate result popularity franchise mainstream appeal franchise like marvel unfortunately get mass spectators became marvel arm chair experts without knowing source material overarching plots laid us seeing posts absurdly review bombing show undeserved sense authority indignation wandavision treat long time fan marvel especially scarlet witch vision us waited see many aspects alluded show completely ecstatic noticing every little hint cleverly woven plot whove read comics like tom kings take vision house certainly feel familiar elements greatly produced homage sitcom history meticulously crafted sets authentically appropriate time also sort psychological horror mystery contrasts nicely idyllic yet unsettling setting best part show lot happening lines highly replayable weekly format great keeps speculation guesswork going every frame filled brim hints clues mystery really entities really play motivations really bold creative swing generally safe formulaic marvel opinion completely successful one far,0.067,0.442,POSITIVE
2021-01-29,9,envisioned something different love writing presentation understand accept style format show presented appreciate greatly pretty genius different like approach story telling biggest concern nit pick didnt wanda showcase powers abilities infinity wars rewind time manipulate reality change timelines events play thanos vision mind stone embedded jarvis dunce sometimes reads books insight acts stupidly times doesnt knowledge jarvis information internet tony stark fingertips seems character two times wanda abilities show used snap vision mind stone imagine infinite knowledge read books completely clueless times,0.082,0.324,POSITIVE
2021-03-03,7,unexpectedly brilliant endgames promised marvel universe time adult stop diverting fantasy nonsense mean something films ridiculous commitment spiderman movies didnt count ok watch frivolous title kinda quirky nostalgic kinds ways builds im writing final episode comes ive impressed astonishing attention detail every aspect storytelling cant fault love story looks amazing week final episode falcon winter soldier starts goddamn itd better good im gonna get dragged suspect late,0.186,0.469,POSITIVE
2021-03-05,10,marvel produces marvel first episodes millennials neither loving understanding marvel created wandavision true marvel lovers embrace marvel brilliance clinge carefully constructed scene wandas story unfolds final couple episodes true excellence marvel really shines wandavision becomes absolutely magical starts definitely finishes,0.045,0.611,POSITIVE
2021-01-15,10,whole season reveiw leave theories behind sit back watch wandavision origin story wanda vision scarlett witch wandavision truley getting wanda ready phase four scarlett witch also story grief loss whilst first episodes weird different rest show truley brilliant great watch every actor amzing job roles lovley see return older mcu actors like kat dennings overall marvel fan empty day watch youre fan wanda must watch casual mcu fan give miss missing,0.156,0.384,POSITIVE
2021-06-28,10,wandavision fantastic show every actor excellent job happy biggest fan mcu,0.0,0.836,POSITIVE
2021-01-15,8,marvel really thought going places totally marvel fans wanna see show completely different real sitcom offense love sitcons wanted id never want marvel one shame thought gonna like leaked plots instead maybe fault tho beginning adversiting expected something else,0.182,0.295,POSITIVE
2021-03-08,10,ending think people thought supposed conclusion scarlet witch beginning people ill admit huge fan series scarlet witch favorite avenger ending kind disappointing unlike many others understand supposed conclusion wandas story instead beginning scarlet witch saga think conclusion perfectly sets everything need phase marvel universe belive wanda main protagonist upsetting since much logical,0.299,0.213,NEGATIVE
2021-02-19,10,yes guys marvel back tbh wasnt expecting much show considering considered romance wanda vision little blah character arch wanda gone mind blowing well ignore sacrifice wanda vision made endgame wanda surely one time fav avenger ofcourse thor back show suspense build throughout style shooting presenting new twists new superheroes villians everything seems right started slow say wandavision one best tv show ever created people saying didnt like finale seriously stupid everything ok may cameos expecting doesnt make show bad two credit scenes mean wow expect see wanda villian doctor strange well guess good mine vision return well classic marvel,0.055,0.496,POSITIVE
2021-03-03,10,worth time good clean unique fun youre coming looking something groundbreaking full action give shot fun clever leave feeling like tv doesnt need solve problems world,0.057,0.639,POSITIVE
2021-01-15,8,enigma first two episodes intriguing crap equal measure want know heading needs get bit quicker either needed released one hit 1950s slapstick mixed bit modern day stuff credits really need nearly minutes worth,0.055,0.353,POSITIVE
2021-11-26,7,different series deffinatly stood good way would expect marvel least episodes anyway im sitcom guy appreciate sitcom thro decades approach used good throwback old sitcoms use watch,0.0,0.545,POSITIVE
2021-01-31,10,wow watch brilliant programme cant wait episodes need watch get two episodes revealed shown makes sense watch however released whole season could prevented poor reviews everyone binge watches series days need minute less episodes week bit ridiculous honest overall entertaining smart production weekly release letting worth watch shame probably money grabbing scam disney marvel,0.132,0.421,POSITIVE
2021-01-15,3,dumb stupid funny sad remake bewitched youngins never heard bewitched look im gonna keep watching hope gets better far working,0.235,0.204,NEGATIVE
2021-01-16,6,let looking forward show ever since learned release let nothing redeemable show ever funny slightest canned laughter really annoying granted watched episodes boy bad seems polish old turd put marvel front,0.279,0.223,NEGATIVE
2021-01-23,1,stunningly bad beyond bad utter drivel start finish,0.786,0.0,NEGATIVE
2021-03-09,10,glad stayed comedy mystery drama takes episodes im really marvel universe unfamiliar characters backstories didnt matter really enjoyed episodes progressed action figures superpowers special effects send old sitcoms may initially appear though really well done evolves much complex darker story things caught attention reference one point dick van dyke may look like walnut episode google genius another episode movie marquee contains reference really poignant scene blade runner elsewhere two characters discuss ship theseus course repairing ending replacing every piece still ship theseus number instances thoughtful writing helpful people want special effects one demerit stereotyping older white wasp male heavy handed villain opposed feisty racially diverse younger characters may required television shows still pandering offensive predictable detracts suspense,0.154,0.234,POSITIVE
2021-04-22,3,art bad story telling five minutes first episode something happed never happend whole family except stopped watching get writers wanted integrate evolution soaps series want pull better make sure either extremely funny put intruiging element right beginning couple super boring episodes interesting plot gets better get past first couple episodes actual story begins still story elements first episodes could well integrated later episodes id give story developped properly first episodes decided ending rather frustrating ridiculous floating people wires convenient turnarounds could worse much worse,0.291,0.127,NEGATIVE
2021-03-05,8,started bumpy ride loved conclusion fantastic show every actor excellent job happy biggest fan mcu,0.0,0.802,POSITIVE
2021-03-05,10,wandavision one single quote boys handle military mommy right back wanda s01e09 series finale,0.0,0.0,NEGATIVE
2021-01-17,8,far good ill start saying acquired taste arent familiar comics deeper lore likely confuse applause disney nailing 50s theme something intriguing know thats something going behind curtain show gives enough peeks keep invested although peeks wouldnt go amiss im definitely curious see go,0.067,0.423,POSITIVE
2021-03-06,8,great ahow fantastic show every actor excellent job happy biggest fan mcu,0.0,0.876,POSITIVE
2021-03-08,10,amazingly refreshing like old school comic book world marvel endless keep creativity coming awesome,0.0,0.707,POSITIVE
2021-08-01,8,surprising entered show sure expect going first marvel tv show connected cinematic universe marvel show saw agent carter shame canceled one favourite shows put simply show ride absolutely fun trying piece story connection marvel universe tidbits every episode mention experimental filming medium film student blast seeing connect overarching story definitely recommend tv show,0.045,0.314,POSITIVE
2021-01-15,7,bad call disney release weekly seems like whole show shouldve put something definitely finally happen later episodes first complete nothingness im definitely intrigued whats come stage cannot recommend anyone cracks reality finally starting show end second episode lets hope picks high point definitely vision gum drunk paul bettany nailed pretty hilarious,0.178,0.373,POSITIVE
2021-03-05,10,allowed tv series nothing short amazing loved every minute get introduced new characters meet old ones every character well written actors great screen different usual mcu stuff better elizabeth olsen deserves emmy nomination best actress drama series amazing blew away everytime screen might stretch also think least nominated best director drama series show could easily done bad great definitely need watch something good allowed tv way good staying late night watch new episode please favor watch show,0.154,0.538,POSITIVE
2021-04-27,8,excellent concept brought life excellent showrunner fantastic show every actor excellent job happy biggest fan mcu,0.0,0.883,POSITIVE
2021-01-15,10,perfect perfect oh perfect absolutely amazing great magical show deserves best awards keep way marvel,0.0,0.944,POSITIVE
2021-01-15,8,wow mix bewitched honeymooners swirl marvel cinematics lovely sitcom,0.0,0.634,POSITIVE
2021-01-25,1,purile twaddle lowest order one lives hope rabid rats attack producers dire excuse anything episodes many next time comes ill bleaching bottom,0.363,0.132,NEGATIVE
2021-03-07,9,weirdly entertaining im sure rate good ridiculously interesting feel lacking something maybe better doesnt take anything away amazingly beautiful show im sad see end,0.103,0.517,POSITIVE
